{
  "probe": "risk",
  "issues": [
    {
      "title": "is_realtime 字段存放位置与读取位置不一致，功能将静默失效",
      "type": "risk",
      "severity": "high",
      "evidence": "JS 侧：「支付成功调用方在 payload 中增加：{ \"is_realtime\": true }」；原生侧：「原生桥从事件对象顶层读取 is_realtime」。JS 把字段放在 payload 内部，原生桥却在事件对象顶层查找，两处路径不匹配。",
      "why_it_matters": "原生桥永远读不到 is_realtime（它在 event.payload.is_realtime 而非 event.is_realtime），所有支付成功事件都会静默进入批量队列，实时上报功能完全不生效。这是一个实现级别的不一致，而非设计取舍。",
      "suggested_fix": "统一读取路径。方案 A：原生桥改为从 payload 内读取；方案 B：JS 侧将 is_realtime 提升到与 name、payload 平级的事件顶层。需在接口文档中明确定义事件对象结构。",
      "confidence": 0.95
    },
    {
      "title": "await 阻塞支付成功页展示，直接违背「不能阻塞支付成功页」的硬性需求",
      "type": "risk",
      "severity": "blocker",
      "evidence": "方案：「支付成功页执行 await reportEvent(...)，确认上传成功后再展示结果页」；需求明确要求：「上报失败不能阻塞支付成功页，也不能改变支付结果」。",
      "why_it_matters": "这是方案与需求之间的直接矛盾。即使重试三次后降级到批量队列，await 仍会在重试期间（含超时等待）阻塞 UI。最坏情况下用户看到白屏或卡死数秒，且阻塞时长完全取决于网络状况，不可控。这还意味着上报链路故障会直接影响用户可感知的支付完成体验。",
      "suggested_fix": "将 reportEvent 调用改为 fire-and-forget：支付成功页展示不依赖上报结果。可在页面展示后异步上报，利用 beforeunload/页面生命周期兜底确保事件不丢；或改为非阻塞的 then/catch 模式，展示结果页与上报并行。",
      "confidence": 0.98
    },
    {
      "title": "JS、原生、服务端三团队同窗口发布在旧客户端共存环境下几乎不可行",
      "type": "compatibility",
      "severity": "high",
      "evidence": "方案：「JS、原生和服务端在同一个版本窗口一起发布」；背景：「JS、原生桥和服务端由不同团队维护；线上存在旧客户端和两个服务端版本」。",
      "why_it_matters": "三团队协调同一发布窗口本身难度极高。更关键的是旧客户端（已有原生桥版本）不会因为服务端或 JS 发布而自动获得 is_realtime 读取能力。旧客户端上的支付成功事件会静默走批量队列，且没有任何机制能检测或告警这种降级。这意味着一部分用户永远无法获得实时上报能力，而团队可能误以为功能已全量生效。",
      "suggested_fix": "明确旧客户端的降级策略：在 JS 侧检测原生桥版本/能力，若不支持实时上报则采用替代方案（如 JS 层直接 HTTP 上报），或至少上报一个「实时能力缺失」的监控事件。制定分阶段发布计划，而非强依赖同窗口。",
      "confidence": 0.9
    },
    {
      "title": "旧原生桥版本对 is_realtime 无感知，功能静默降级且无告警",
      "type": "compatibility",
      "severity": "medium",
      "evidence": "「线上存在旧客户端」；原生桥逻辑：「原生桥从事件对象顶层读取 is_realtime。为 true 时立即调用上传接口，否则进入原批量队列」。旧版本原生桥不包含此判断逻辑。",
      "why_it_matters": "旧原生桥收到含 is_realtime 的事件后，因不认识该字段，所有事件照常进入批量队列。从业务视角看功能「已上线」，但旧客户端用户实际未受益。如果缺乏按客户端版本分组的监控，团队将无法区分「实时上报正常」和「静默回退到批量」。",
      "suggested_fix": "增加客户端版本维度的上报监控；或在 JS 侧做能力探测，对不支持实时上报的原生桥版本采用 JS 直连上报作为降级路径。",
      "confidence": 0.85
    },
    {
      "title": "三次立即重试无退避策略，可能加剧网络抖动期间的阻塞与请求风暴",
      "type": "risk",
      "severity": "medium",
      "evidence": "「实时上传失败时立即重试三次」。结合 await 阻塞模式，重试无间隔意味着在数百毫秒内对同一 endpoint 发起 4 次请求。",
      "why_it_matters": "「立即」重试在网络瞬时故障（如丢包、连接重置）场景下大概率全部失败，徒增延迟而无收益。同时 4 次密集请求在弱网环境下反而可能加重拥塞。另外，若服务端已成功接收但响应丢包，3 次重试会产生 3 条重复记录（虽可被 event_id 去重，但浪费带宽和服务端资源）。",
      "suggested_fix": "采用指数退避重试策略（如 200ms → 600ms → 1800ms），并设置总超时上限（如 5 秒），超时后直接降级到批量队列。对可重试错误（5xx、网络错误）和不可重试错误（4xx）区分处理。",
      "confidence": 0.8
    },
    {
      "title": "仅开发环境验收，缺乏生产环境可观测性设计",
      "type": "observability",
      "severity": "medium",
      "evidence": "「验收方式：开发环境能看到支付成功事件请求立即发出，普通事件仍进入批量队列」。未提及任何生产环境监控、告警或数据对比机制。",
      "why_it_matters": "实时上报的可靠性（成功率、延迟、降级到批量队列的比例）在生产环境完全不可见。当实时通道出现问题时，团队无法主动发现，只能依赖用户反馈。尤其结合旧客户端共存的情况，缺乏监控会导致对功能覆盖率产生严重误判。",
      "suggested_fix": "至少增加以下观测点：(1) 实时上报成功率与 P99 延迟；(2) 降级到批量队列的次数与比例；(3) 按客户端版本维度的实时/批量分布；(4) 实时上报失败原因的分布（超时/5xx/网络错误）。",
      "confidence": 0.9
    },
    {
      "title": "event_id 的生成规则未定义，跨实时与批量路径的去重可能失效",
      "type": "assumption",
      "severity": "medium",
      "evidence": "「服务端仅对带有 event_id 的事件去重」；实时失败后「重新放入批量队列」。但方案中未说明 event_id 由谁生成、何时生成、实时路径与批量路径是否使用同一个 event_id。",
      "why_it_matters": "如果 event_id 在每次上报尝试时重新生成（例如在原生桥层每次调用生成新 UUID），则实时路径失败后放入批量队列的事件将携带不同的 event_id，服务端无法识别为重复，导致同一支付成功事件被计数多次。虽然影响范围有限（仅在实时失败且降级时发生），但会直接污染支付事件的数据准确性。",
      "suggested_fix": "明确 event_id 在 JS 层生成一次，随事件对象一路传递到原生桥，实时和批量路径共用同一个 event_id。在接口契约中固化此规则。",
      "confidence": 0.75
    }
  ],
  "missing_questions": [
    "实时上传接口的超时时间是多少？是否与批量上传接口相同？",
    "服务端是否需要为实时上报做任何改动（如独立限流、独立 endpoint）？",
    "当 JS 版本已更新但原生桥版本未更新时，是否有 JS 侧的降级上报方案？",
    "如何验证旧客户端上的支付成功事件最终没有丢失（端到端数据对账机制）？",
    "reportEvent 的 await 行为是否会改变现有调用方的语义？现有调用方是否有依赖其同步/异步行为的代码？"
  ],
  "false_positive_risks": [
    "实时上报直接调用上传接口会导致服务端过载 — 支付成功是低频事件（相对整体事件量），且使用已有上传接口，服务端已承载批量上传的吞吐，单条实时请求对服务端压力可忽略。若支付 QPS 极高则另议，但当前方案未给出需要担心的量级依据。",
    "实时失败降级到批量队列会导致事件乱序 — 需求中未提及事件顺序的强一致性要求，且支付成功事件与其他事件之间无因果依赖。服务端按 event_id 去重而非按时序处理，乱序不构成业务问题。"
  ]
}
