{
  "probe": "architecture",
  "issues": [
    {
      "title": "await + 重试机制直接违反\"不能阻塞支付成功页\"的硬性约束",
      "type": "boundary",
      "severity": "blocker",
      "evidence": "需求明确\"上报失败不能阻塞支付成功页，也不能改变支付结果\"，但方案第3点要求\"支付成功页执行 await reportEvent(...)，确认上传成功后再展示结果页\"，第4点又叠加\"立即重试三次\"。在最差网络场景下，用户将在支付成功页被阻塞等待 1次请求 + 3次重试的完整耗时。",
      "why_it_matters": "这是需求层面的硬性约束（不可改变支付结果、不可阻塞），方案的核心路径直接与之矛盾。一旦网络抖动，支付成功页将长时间白屏或转圈，严重影响用户信任，甚至可能因用户误以为支付失败而重复支付。",
      "suggested_fix": "采用 fire-and-forget 模式：支付成功后立即展示结果页，实时上报在后台异步执行。若需保证不丢失，可先持久化到本地队列再异步发送，由后台任务保证最终送达，而非在 UI 关键路径上 await。",
      "confidence": 0.97
    },
    {
      "title": "传输层元数据侵入业务 payload，形成隐式契约",
      "type": "abstraction",
      "severity": "medium",
      "evidence": "方案第1点\"保持 reportEvent 函数签名不变\"，但将路由指令 { \"is_realtime\": true } 放入 payload 内部。第2点\"原生桥从事件对象顶层读取 is_realtime\"依赖调用方在 payload 中正确设置该字段。",
      "why_it_matters": "payload 的语义是业务数据，is_realtime 是传输路由策略，二者混在同一层级会导致：(1) 服务端或其他消费者需要理解 payload 中的隐藏字段；(2) 未来其他事件也需要实时上报时，每个调用方都要知道这个\"潜规则\"；(3) 缺乏类型约束和文档化，容易遗漏或误用。",
      "suggested_fix": "在 reportEvent 函数签名中增加可选的 options 参数（如 reportEvent(name, payload, options)），将 is_realtime 作为 options 的一部分。这样传输策略与业务数据分层清晰，且可通过类型系统强制约束。如果签名确实不能改，至少在 payload 中定义一个受保留的 _meta 命名空间。",
      "confidence": 0.85
    },
    {
      "title": "三团队同步发布窗口制造强耦合，且与线上多版本现实冲突",
      "type": "coupling",
      "severity": "high",
      "evidence": "方案第5点\"JS、原生和服务端在同一个版本窗口一起发布\"，而需求背景明确\"线上存在旧客户端和两个服务端版本\"，且\"JS、原生桥和服务端由不同团队维护\"。",
      "why_it_matters": "三个独立团队在同一窗口同步发布，协调成本高、回滚风险大。更关键的是：发布后线上仍然会存在旧客户端（不含 is_realtime 逻辑）和两个服务端版本。方案没有说明：(1) 旧客户端产生的支付事件如何处理；(2) 两个服务端版本是否都支持实时上报接口；(3) 灰度期间新旧版本并存时的行为。",
      "suggested_fix": "设计应具备版本兼容性：服务端两个版本都应能接受带 is_realtime 的请求（老版本忽略即可）；客户端应能检测服务端能力或通过 feature flag 控制是否启用实时上报，从而允许各团队独立发布和灰度。",
      "confidence": 0.9
    },
    {
      "title": "重试失败后回退批量队列存在重复上报风险，方案未利用 event_id 去重",
      "type": "dependency",
      "severity": "medium",
      "evidence": "需求背景指出\"服务端仅对带有 event_id 的事件去重\"。方案第4点\"仍失败则重新放入批量队列\"，但未提及在实时上报请求中是否携带 event_id。",
      "why_it_matters": "网络超时场景下，实时上报请求可能已到达服务端并入库，但客户端因超时而判定失败，随后将同一事件重新放入批量队列。如果两次上报均不携带相同的 event_id，服务端无法去重，导致支付成功事件被重复记录，影响数据分析准确性和可能的下游业务逻辑。",
      "suggested_fix": "在客户端为每次 reportEvent 调用生成唯一 event_id，并在实时上报和批量上报中均携带该 ID。重试时应使用相同的 event_id，确保服务端能正确去重。",
      "confidence": 0.88
    },
    {
      "title": "验收标准仅覆盖正向路径，缺乏失败场景和兼容性验收",
      "type": "maintainability",
      "severity": "medium",
      "evidence": "方案第6点验收方式仅为\"开发环境能看到支付成功事件请求立即发出，普通事件仍进入批量队列\"。",
      "why_it_matters": "该验收标准完全忽略了：(1) 网络失败时的降级行为（是否回退批量队列）；(2) 旧客户端的支付事件是否正常；(3) 两个服务端版本的兼容性；(4) 重试期间对支付成功页的阻塞时长。缺乏这些验收条件，上线后极易出现未覆盖的故障场景。",
      "suggested_fix": "补充验收场景：弱网/断网环境下的降级行为、旧客户端回归测试、服务端双版本兼容性验证、以及支付成功页在上报超时情况下的响应时间上限。",
      "confidence": 0.82
    }
  ],
  "missing_questions": [
    "旧客户端（不含 is_realtime 逻辑）的支付成功事件在新服务端版本上如何处理？是否有降级路径？",
    "两个服务端版本对实时上报接口的支持情况分别是什么？是否需要老版本服务端做适配？",
    "实时上报的超时阈值是多少？3次重试的总耗时上限是否有硬性约束？",
    "批量队列中的事件与实时上报的事件是否使用相同的去重 event_id？",
    "是否存在支付成功事件以外的其他事件也需要实时上报的场景？如果有，当前设计如何扩展？"
  ],
  "false_positive_risks": [
    "如果团队已经确认支付成功页的 await 超时极短（如 500ms）且有完善的降级兜底，则第1个 blocker 问题的严重性可能降低，但从方案文本中无法确认这一点",
    "如果 is_realtime 仅作为临时过渡方案，后续版本会引入正式的 options 参数，则第2个抽象层问题可视为可接受的短期权衡"
  ]
}
