{
  "probe": "architecture",
  "issues": [
    {
      "title": "await 阻塞与「上报失败不阻塞支付成功页」需求直接矛盾",
      "type": "dependency",
      "severity": "blocker",
      "evidence": "需求明确要求「上报失败不能阻塞支付成功页，也不能改变支付结果」，但方案设计为「支付成功页执行 await reportEvent(...)，确认上传成功后再展示结果页，确保事件不会丢失」，且实时上传失败时立即重试三次才降级入批量队列，重试期间页面被阻塞。",
      "why_it_matters": "支付页展示时机被绑定到上报链路的网络状态与重试耗时上，一旦网络抖动或服务端不可达，用户将长时间卡在等待状态，严重损害支付体验。这与需求明确声明的非阻塞约束冲突，属于设计级缺陷，不应通过实现阶段弥补。",
      "suggested_fix": "上报与页面展示必须解耦：页面在发起支付成功后立即展示结果页，上报在后台 fire-and-forget 执行。如需保证上报可靠性，应由上报层自身（原生桥或批量队列）保证最终一致性，而非让调用方 await。实时通道失败降级入批量队列的设计可以保留，但调用方不应等待其完成。",
      "confidence": 0.95
    },
    {
      "title": "通过 payload 传递传输控制指令导致边界泄漏",
      "type": "boundary",
      "severity": "high",
      "evidence": "支付成功调用方在 payload 中增加 { \"is_realtime\": true }，原生桥从事件对象顶层读取 is_realtime 决定传输策略。",
      "why_it_matters": "payload 本应是业务事件数据，属于数据层概念。is_realtime 是传输控制指令，属于传输层概念。将控制指令混入数据 payload，要求 JS 调用方、原生桥、甚至服务端（如需区分处理）都必须理解这个约定，造成跨层泄漏。未来增加更多传输策略（如优先级、TTL、压缩策略）会进一步污染 payload 结构，扩展成本高。",
      "suggested_fix": "传输策略应在 API 层面显式表达，例如 reportEvent(name, payload, { mode: 'realtime' }) 或通过独立函数 reportRealtimeEvent(name, payload)，由 JS SDK 层处理策略枚举后通过桥接层独立通道传递，不混入业务 payload。",
      "confidence": 0.85
    },
    {
      "title": "三端强制同步发布在已有旧客户端和双服务端版本下风险极高",
      "type": "coupling",
      "severity": "high",
      "evidence": "方案要求「JS、原生和服务端在同一个版本窗口一起发布」，但背景已说明「线上存在旧客户端和两个服务端版本」。",
      "why_it_matters": "三端耦合发布意味着任何一端延迟或回滚都会阻塞整体上线。旧客户端无法升级到含 is_realtime 解析能力的原生桥，其支付成功事件将静默进入批量队列（可能完全丢失实时语义），而上线窗口内新旧版本交错期间可能出现 JS 发了 is_realtime 但桥不识别、或桥识别了但服务端不处理的兼容性断裂。这种强制同步发布模型在已有碎片化版本的线上环境几乎不可安全执行。",
      "suggested_fix": "应设计向前兼容的协议：原生桥版本号与服务端能力通过握手或 capability 标记协商。旧桥看到不认识的字段应安全忽略并走默认批量路径（已有行为），新桥与服务端独立上线，不要求同步。或者先上服务端和原生桥（向后兼容旧 JS 不传 is_realtime），再灰度 JS 侧改动。",
      "confidence": 0.9
    },
    {
      "title": "重试与降级逻辑放置在原生桥但调用方通过 await 感知其结果，职责错位",
      "type": "ownership",
      "severity": "medium",
      "evidence": "实时上传失败时立即重试三次；仍失败则重新放入批量队列。支付成功页 await reportEvent(...) 等待这一过程完成。",
      "why_it_matters": "重试与降级是上报基础设施的内部实现细节，调用方不应感知其结果（成功或降级入队列），更不应等待其完成。当前设计既让原生桥承担了重试编排职责，又让 JS 调用方通过 await 与这一过程时序耦合，导致基础设施变更（如调整重试次数、增加退避策略）会影响调用方的页面展示时机。",
      "suggested_fix": "明确上报为异步非阻塞语义：reportEvent 返回 void 或 Promise<void> 但不代表上传完成（仅代表已提交到基础设施）。基础设施内部自行处理重试与降级。如需监控上报结果，通过独立的 observability 通道（如成功率大盘、告警）而非调用方 await。",
      "confidence": 0.8
    },
    {
      "title": "is_realtime 布尔值缺乏传输策略的扩展空间",
      "type": "extensibility",
      "severity": "low",
      "evidence": "设计仅使用 boolean is_realtime 来表达传输策略，且位于 payload 内部。",
      "why_it_matters": "未来若需要更多传输模式（如高优先级但仍批量、低延迟但允许降级、仅 WiFi 上传等），boolean 无法表达，且扩展方式只能继续在 payload 中追加字段，加速 payload 污染。虽为第一版，但传输策略是基础设施级概念，初期设计应预留枚举或策略标识空间。",
      "suggested_fix": "将传输模式定义为独立枚举（如 delivery: 'realtime' | 'batch'），作为 API 参数而非 payload 字段。即使第一版只有两个值，枚举比 boolean 更具可读性和扩展性。",
      "confidence": 0.7
    }
  ],
  "missing_questions": [
    "旧客户端（无新原生桥）的支付成功事件如何处理？是否可接受其走批量队列？",
    "服务端是否需要对实时事件和批量事件做差异化处理？如果是，is_realtime 是否也需要传递给服务端？",
    "实时上传接口的 SLA 是多少？三次立即重试在网络抖动场景下预计阻塞多久？",
    "如果只有部分端上线（如 JS 已发但原生桥未发），中间状态的兼容行为是什么？",
    "是否需要考虑实时事件去重？需求提到服务端仅对 event_id 去重，实时事件是否也有 event_id？"
  ],
  "false_positive_risks": [
    "如果支付成功页实际是 native 页面且 await 的是原生桥返回的本地 Promise（不涉及网络等待），则阻塞问题可能不成立——但方案描述为「确认上传成功后再展示」，暗示等待网络结果，故判定为有效问题。",
    "is_realtime 放在 payload 中在某些轻量级方案中可能被接受为 pragmatic 选择（避免改函数签名），但鉴于三端分离维护的现实，边界泄漏的风险是真实且显著的。",
    "三端同步发布在部分组织内可能是标准流程，但需求明确提到旧客户端和双服务端版本，表明碎片化已是现状，同步发布的假设不成立。"
  ]
}
