{
  "probe": "execution",
  "issues": [
    {
      "title": "步骤3的await阻塞支付成功页，违反硬约束",
      "type": "step",
      "severity": "blocker",
      "evidence": "需求硬约束：\"上报失败不能阻塞支付成功页，也不能改变支付结果\"。步骤3：\"支付成功页执行 await reportEvent(...)，确认上传成功后再展示结果页\"。步骤4：\"实时上传失败时立即重试三次；仍失败则重新放入批量队列\"。",
      "why_it_matters": "await 会等待整个重试周期（最多3次）完成后才展示结果页。在网络超时场景下，用户将被阻塞在支付成功页上数十秒，直接违反\"上报失败不能阻塞支付成功页\"的硬约束。实现者无法在不违反步骤3或硬约束的情况下完成开发。",
      "suggested_fix": "明确 reportEvent 在实时上传场景下的阻塞边界：例如仅等待首次上传尝试的结果（设定合理的短超时），无论成功与否均立即展示结果页；重试和批量回退在后台异步完成。计划需声明页面展示不依赖于上传最终结果。",
      "confidence": 0.95
    },
    {
      "title": "is_realtime 字段位置在步骤1和步骤2之间矛盾",
      "type": "ambiguity",
      "severity": "high",
      "evidence": "步骤1：\"在 payload 中增加 is_realtime: true\"。步骤2：\"原生桥从事件对象顶层读取 is_realtime\"。",
      "why_it_matters": "如果事件对象结构为 {name, payload: {...}}，则 payload 内部的字段不在顶层。JS 团队将字段放在 payload 内，而原生桥在顶层查找，导致实时标记永远无法被读取，所有支付事件仍走批量队列。",
      "suggested_fix": "统一 is_realtime 的放置位置：明确是放在 payload 内部还是作为事件对象的顶层字段，并同步修改步骤1或步骤2的描述。",
      "confidence": 0.85
    },
    {
      "title": "event_id 生成责任未指定，实时-批量回退路径存在重复上报风险",
      "type": "dependency",
      "severity": "high",
      "evidence": "需求：\"服务端仅对带有 event_id 的事件去重\"。步骤4：\"实时上传失败时立即重试三次；仍失败则重新放入批量队列\"。计划全文未提及 event_id。",
      "why_it_matters": "实时上传可能在发送请求后、收到响应前超时（服务端已接收但客户端认为失败）。此时事件进入批量队列再次发送，若无 event_id，服务端无法去重，导致支付事件重复记录。实现者无法确定由谁（JS层、原生桥、还是服务端）负责生成 event_id 以及在哪个环节附加。",
      "suggested_fix": "在计划中明确 event_id 的生成方（建议客户端生成，确保实时和批量路径使用同一 ID）、生成时机（调用 reportEvent 时）以及传递方式（放在 payload 还是事件对象顶层）。",
      "confidence": 0.9
    },
    {
      "title": "实时上传接口的端点、协议和请求格式未定义",
      "type": "interface",
      "severity": "high",
      "evidence": "步骤2：\"为 true 时立即调用上传接口\"。计划未指定该接口的端点地址、HTTP 方法、请求体格式、认证方式或响应结构。",
      "why_it_matters": "原生桥团队无法确定调用什么接口。不知道是使用现有批量队列的 flush 接口、还是需要新的专用接口。步骤5要求三个团队同步发布，但服务端团队不知道需要实现或维护哪个端点。",
      "suggested_fix": "补充实时上传接口的定义：复用现有接口还是新增接口、端点路径、请求方法、请求体结构、所需 headers、以及成功和失败的响应格式。",
      "confidence": 0.85
    },
    {
      "title": "reportEvent 返回值语义未定义，await 的成功失败判断依据不明",
      "type": "output",
      "severity": "medium",
      "evidence": "步骤1：\"保持 reportEvent 函数签名不变\"。步骤3：\"await reportEvent(...)，确认上传成功后再展示结果页\"。步骤4依赖上传失败来触发重试和回退逻辑。",
      "why_it_matters": "当前 reportEvent 进入批量队列时可能不返回 Promise 或总是 resolve（fire-and-forget）。步骤3需要区分上传成功与失败来决定是否展示结果页，步骤4需要知道失败才能触发重试。计划未定义返回值的类型、成功时的值、失败时的错误类型，以及批量事件是否也受影响。",
      "suggested_fix": "定义 reportEvent 的返回值契约：返回 Promise 时的 resolve 和 reject 条件、返回值结构、以及 is_realtime 为 false 时返回值是否变化（确保不破坏现有批量事件的调用方）。",
      "confidence": 0.8
    },
    {
      "title": "旧客户端和双版本服务端的兼容性未处理",
      "type": "dependency",
      "severity": "medium",
      "evidence": "需求：\"线上存在旧客户端和两个服务端版本\"。步骤5：\"JS、原生和服务端在同一个版本窗口一起发布\"。",
      "why_it_matters": "即使在同一个版本窗口发布，灰度期间仍会出现新客户端命中旧服务端（实时上传接口可能不存在）和旧客户端命中新服务端（不发送 is_realtime）的情况。计划未说明这些混合版本场景下的行为预期和降级策略。",
      "suggested_fix": "补充发布期间的兼容性说明：新客户端调用旧服务端时实时上传接口的降级行为（如接口不存在时直接走批量队列）、旧客户端事件在新服务端的处理方式。",
      "confidence": 0.75
    }
  ],
  "missing_questions": [
    "当前 reportEvent 的返回值类型是什么？是否已经返回 Promise？",
    "原生桥接收到的事件对象结构是什么？payload 是顶层字段还是嵌套在更深层？",
    "现有批量队列的上传机制是什么？使用哪个端点和协议？",
    "实时上传接口的服务端是否已存在，还是需要本次新建？",
    "两个服务端版本之间的差异是什么？是否影响事件接收或去重逻辑？"
  ],
  "false_positive_risks": [
    "步骤5的同步发布策略看似风险高，但对于一个向后兼容的字段新增（is_realtime 默认为 false 或不存在），同步发布窗口是合理的选择，不构成执行阻塞。",
    "计划未提及新消息平台或数据库，但这是需求明确排除的（第一版不建设新的消息平台或数据库），不是遗漏。",
    "步骤4的重试次数（3次）是具体参数，但属于计划已给出的决策，不应作为缺口提出。"
  ]
}
