{
  "probe": "architecture",
  "issues": [
    {
      "title": "支付结果页展示被事件上报流程阻塞，违反硬约束",
      "type": "coupling",
      "severity": "blocker",
      "evidence": "方案第3点要求「支付成功页执行 await reportEvent(...)，确认上传成功后再展示结果页」；方案第4点规定实时上传失败时重试三次，仍失败则重新放入批量队列。需求硬约束明确规定「上报失败不能阻塞支付成功页，也不能改变支付结果」。",
      "why_it_matters": "当实时上传失败时，用户需要等待三次重试完成后事件才会回退到批量队列，期间支付结果页被阻塞。若 await 解析为失败，设计意图（确认上传成功后再展示）与硬约束（不能改变支付结果）产生直接矛盾：要么不展示结果页（改变支付结果），要么在未确认上传成功时展示（违背设计意图）。无论哪种情况，控制流与硬约束无法同时满足。",
      "suggested_fix": "将事件上报与支付结果页展示解耦：支付结果页不依赖 reportEvent 的返回值来决定是否展示，上报流程在后台异步执行，失败回退到批量队列时不影响用户界面。",
      "confidence": 0.95
    },
    {
      "title": "传输路由指令嵌入事件数据负载，造成跨层泄漏",
      "type": "boundary",
      "severity": "medium",
      "evidence": "方案第1点在 payload 中增加 { \"is_realtime\": true } 作为路由指令；方案第2点原生桥从事件对象顶层读取 is_realtime 来决定传输路径。payload 语义上是事件业务数据，is_realtime 是传输层路由策略。",
      "why_it_matters": "传输层关注点（是否实时上传）通过非结构化的 payload 字段传递给原生桥，形成隐式契约。任何 JS 调用方都可以在任意事件的 payload 中设置 is_realtime: true，触发实时上传路径，而没有中心化的路由策略管控。这导致路由决策的所有权分散在所有调用方，原生桥对 payload 内部字段的依赖使数据层和传输层产生双向耦合。",
      "suggested_fix": "将传输路由策略从事件数据 payload 中分离，使路由决策由单一层次拥有，调用方无需感知传输机制。",
      "confidence": 0.8
    },
    {
      "title": "跨团队强制同步发布缺乏结构性必要",
      "type": "dependency",
      "severity": "medium",
      "evidence": "方案第5点要求「JS、原生和服务端在同一个版本窗口一起发布」。需求背景指出 JS、原生桥和服务端由不同团队维护，线上存在旧客户端和两个服务端版本。is_realtime 是客户端侧路由决策，服务端接收事件的方式不因该字段而改变。",
      "why_it_matters": "三个由不同团队维护的组件被强制同步发布，但方案未说明服务端需要为此特性做任何变更。如果服务端不需要理解 is_realtime（它只接收已上传的事件），则同步发布引入了不必要的发布耦合，限制了各团队的独立演进能力，且与线上已有的版本多样性（旧客户端、两个服务端版本）相矛盾。",
      "suggested_fix": "明确服务端是否需要为此特性做变更；若不需要，移除同步发布约束，允许各组件独立发布。",
      "confidence": 0.7
    }
  ],
  "missing_questions": [
    "支付成功事件是否已携带 event_id？若未携带，实时上传三次失败后回退到批量队列的路径中，若某次实时上传实际被服务端接收但响应丢失，客户端重试将产生服务端无法去重的重复事件。",
    "reportEvent 在实时上传失败但事件被重新放入批量队列时，返回给 await 调用方的值是什么？是成功（已入队）还是失败（未上传）？该返回值直接决定支付结果页的展示逻辑。",
    "服务端是否需要对支付成功事件做任何差异化处理？若不需要，方案第5点的同步发布约束的依据是什么？"
  ],
  "false_positive_risks": [
    "重试次数（三次）和超时参数看似可能影响用户体验，但属于实现细节而非结构性问题，不构成架构缺陷。",
    "is_realtime 使用布尔值而非枚举或优先级机制看似扩展性不足，但当前需求仅区分实时与批量两种模式，属于接口偏好而非结构问题。",
    "未建设集中式事件路由配置或消息平台看似缺少统一管控，但需求明确约束「第一版不建设新的消息平台或数据库」，在单一实时事件类型场景下，分散路由可能是合理的简化。"
  ]
}
