{
  "probe": "risk",
  "issues": [
    {
      "title": "Step 3 直接违反\"上报失败不能阻塞支付成功页\"的需求",
      "type": "risk",
      "severity": "blocker",
      "evidence": "需求明确要求\"上报失败不能阻塞支付成功页，也不能改变支付结果\"，但 Step 3 写道\"确认上传成功后再展示结果页，确保事件不会丢失\"。Step 4 的三次重试进一步放大了阻塞时长。",
      "why_it_matters": "如果网络抖动或服务端响应慢，用户将在支付成功页长时间等待（3 次重试 + 每次超时），严重影响支付体验，甚至可能导致用户重复支付或放弃。这与需求的核心约束直接矛盾。",
      "suggested_fix": "支付成功页应先展示结果，reportEvent 改为 fire-and-forget 或设置极短的总超时（如 2 秒），超时后直接展示结果页，事件降级到批量队列。",
      "confidence": 0.97
    },
    {
      "title": "is_realtime 字段位置在 Step 1 和 Step 2 之间不一致",
      "type": "compatibility",
      "severity": "high",
      "evidence": "Step 1 说\"在 payload 中增加 { is_realtime: true }\"，Step 2 说\"原生桥从事件对象顶层读取 is_realtime\"。reportEvent(name, payload) 的 payload 参数在原生桥侧是否被展开到事件对象顶层，方案未说明。",
      "why_it_matters": "如果原生桥将 payload 作为嵌套对象处理（如 event.payload.is_realtime），而 Step 2 从顶层读取（event.is_realtime），则实时标记永远读不到，支付事件将全部走批量队列，功能完全失效。",
      "suggested_fix": "明确约定 is_realtime 的传递路径：要么 Step 1 改为在 reportEvent 的独立参数中传递，要么 Step 2 改为从 event.payload 中读取，并在接口文档中固化。",
      "confidence": 0.9
    },
    {
      "title": "未保证支付事件携带 event_id，网络超时场景下会产生重复数据",
      "type": "data",
      "severity": "high",
      "evidence": "需求说明\"服务端仅对带有 event_id 的事件去重\"。Step 4 中，实时上传若服务端已处理但响应超时，客户端会认为失败并将事件重新放入批量队列，导致同一事件被上报两次。方案未提及为支付事件生成或携带 event_id。",
      "why_it_matters": "支付成功事件重复上报可能导致下游数据分析错误、对账异常，甚至触发重复的业务回调（如重复发货通知），影响数据一致性和业务信任。",
      "suggested_fix": "在调用方或原生桥层为支付成功事件生成唯一 event_id（如 UUID），并写入 payload，确保服务端可据此去重。",
      "confidence": 0.88
    },
    {
      "title": "三端同版本窗口发布在存在旧客户端和双服务端版本的环境下风险极高",
      "type": "compatibility",
      "severity": "high",
      "evidence": "需求提到\"线上存在旧客户端和两个服务端版本\"。Step 5 要求\"JS、原生和服务端在同一个版本窗口一起发布\"。方案未说明：(1) 新客户端向旧服务端发送实时请求时的兼容性；(2) 发布窗口期间新旧组件交叉组合的行为；(3) 旧客户端永远不会发送 is_realtime，旧服务端是否能正常处理新格式。",
      "why_it_matters": "App 发布需要应用商店审核，无法与 JS/服务端精确同步。在发布窗口期间，新客户端可能命中旧服务端导致实时上传接口 404 或异常，而方案没有降级策略覆盖这种场景。",
      "suggested_fix": "设计应兼容\"新客户端 + 旧服务端\"组合：实时上传接口失败时自动降级到批量队列（Step 4 已部分覆盖），但需明确旧服务端的行为并写入兼容矩阵。放弃\"同版本窗口\"假设，改为各端独立可发布。",
      "confidence": 0.85
    },
    {
      "title": "三次立即重试无退避策略，在网络故障场景下加剧阻塞",
      "type": "risk",
      "severity": "medium",
      "evidence": "Step 4 写道\"实时上传失败时立即重试三次\"，未提及任何退避（backoff）或超时上限。",
      "why_it_matters": "若失败原因是网络中断或服务端宕机，三次立即重试大概率全部失败，白白增加数秒延迟。结合 Step 3 的 await 阻塞，用户等待时间被进一步放大。",
      "suggested_fix": "设置单次请求超时（如 2-3 秒），三次重试总时间上限不超过 5 秒，或改用指数退避。更重要的是，结合 Step 3 的修复，整体超时后应放行页面展示。",
      "confidence": 0.82
    },
    {
      "title": "验收标准仅覆盖开发环境正常路径，缺少异常和兼容性验证",
      "type": "observability",
      "severity": "medium",
      "evidence": "Step 6 验收方式为\"开发环境能看到支付成功事件请求立即发出，普通事件仍进入批量队列\"。未覆盖：实时上传失败降级、旧客户端兼容、双服务端版本兼容、event_id 去重、阻塞超时等场景。",
      "why_it_matters": "仅验证正常路径意味着上述多个高风险场景在上线前不会被发现，问题将直接暴露在生产环境。",
      "suggested_fix": "验收清单应至少增加：(1) 模拟上传失败后事件进入批量队列；(2) 旧客户端上报支付事件仍走批量队列；(3) 新客户端对旧服务端的降级行为；(4) 重复 event_id 的去重验证；(5) 页面阻塞超时上限验证。",
      "confidence": 0.8
    },
    {
      "title": "方案缺少回滚策略",
      "type": "rollback",
      "severity": "medium",
      "evidence": "方案六个步骤中没有任何一步提及回滚计划。如果上线后发现实时上传导致支付页面大面积阻塞或服务端压力异常，没有明确的降级开关或回滚路径。",
      "why_it_matters": "支付链路是核心业务路径，出问题时需要秒级降级。没有回滚策略意味着只能通过发版修复，延长故障时间。",
      "suggested_fix": "增加服务端或客户端配置开关（如远程配置 is_realtime 功能的启用/禁用），出问题时可远程关闭实时上报，所有事件自动回退到批量队列。",
      "confidence": 0.75
    }
  ],
  "missing_questions": [
    "实时上传接口的单次超时时间是多少？总阻塞时间上限是多少？",
    "支付成功事件是否已携带 event_id？如果没有，由哪一层负责生成？",
    "旧服务端收到带有 is_realtime 标记的事件或新的实时上传请求时，具体行为是什么？",
    "是否存在远程开关可以在不发版的情况下关闭实时上报功能？",
    "批量队列的上传周期和最大延迟是多少？支付事件降级到批量队列后，最迟多久会被上报？"
  ],
  "false_positive_risks": [
    "保持 reportEvent 函数签名不变 — 这是合理的设计约束，通过 payload 扩展字段是常见的向后兼容做法，不构成风险。",
    "第一版不建设新的消息平台或数据库 — 这是明确的范围约束，不是遗漏，标记为 preference。"
  ]
}
