{
  "probe": "execution",
  "issues": [
    {
      "title": "await reportEvent 直接违反'上报失败不能阻塞支付成功页'硬约束",
      "type": "ambiguity",
      "severity": "blocker",
      "evidence": "步骤3原文：'支付成功页执行 await reportEvent(...)，确认上传成功后再展示结果页，确保事件不会丢失。'；背景硬约束：'上报失败不能阻塞支付成功页，也不能改变支付结果。'",
      "why_it_matters": "await 使支付结果页的渲染在事件上报完成（含3次重试）后才执行；上报慢或持续失败时页面一直不展示，直接违反'不能阻塞'和'不能改变支付结果'两条硬约束，让步骤3无法以当前描述执行。",
      "suggested_fix": "将 await 改为非阻塞调用（如 fire-and-forget 或 Promise 不阻塞页面渲染），并在计划中明确：支付结果页立即展示，上报结果不影响页面展示时机；事件不丢失由步骤4的批量回退保证，而非由页面等待保证。",
      "confidence": 0.95
    },
    {
      "title": "payment success 事件的 event_id 生成责任与去重契约未指定",
      "type": "input",
      "severity": "high",
      "evidence": "背景原文：'服务端仅对带有 event_id 的事件去重'；方案全文未提及是否为支付成功事件增加 event_id，也未指定由谁生成、如何保证唯一。",
      "why_it_matters": "实时上报成功后若网络层导致重复到达（如请求已发出但响应丢失后重试），或实时失败回退批量后再上报，服务端无法去重；缺少 event_id 的生成责任与字段路径，原生桥和服务端实现者无法确定是否需要为该字段做适配，步骤2和步骤5的服务端侧无法完成。",
      "suggested_fix": "在方案中补充：支付成功事件是否携带 event_id；若携带，由 JS 调用方、原生桥还是服务端负责生成；字段在 payload 中的路径名称；服务端对无 event_id 事件的重复容忍策略。",
      "confidence": 0.9
    },
    {
      "title": "实时上传失败回退批量队列时 is_realtime 标志处理未定义",
      "type": "ambiguity",
      "severity": "medium",
      "evidence": "步骤2原文：'为 true 时立即调用上传接口，否则进入原批量队列'；步骤4原文：'仍失败则重新放入批量队列'。未说明重新放入时 is_realtime 字段是否被移除或保留。",
      "why_it_matters": "若 is_realtime 保留在回退事件中，批量队列处理逻辑读到 is_realtime=true 会再次尝试实时上传，形成与步骤4'放入批量队列'语义矛盾；若移除，需明确由哪一方（原生桥还是 JS）负责清除，实现者无法对批量队列的消费逻辑作出唯一解释。",
      "suggested_fix": "补充：回退批量队列时 is_realtime 字段的处置规则（移除或保留），以及批量队列消费者遇到该字段时的处理语义，使原生桥实现者有唯一解释。",
      "confidence": 0.85
    },
    {
      "title": "原生桥调用的'上传接口'未指定具体端点与方法",
      "type": "command",
      "severity": "medium",
      "evidence": "步骤2原文：'立即调用上传接口'，未指出该上传接口是现有哪个原生方法/网络端点，还是需要新增。",
      "why_it_matters": "原生桥团队需要知道调用哪个具体接口（现有批量上传的同一端点改为即时调用，还是新增独立端点），否则步骤2无法开始编码。",
      "suggested_fix": "补充：实时上传使用的具体接口名称或端点路径，以及与现有批量上报端点是同一还是独立；若需新增，说明新增接口的契约（路径、方法、请求体格式）。",
      "confidence": 0.8
    },
    {
      "title": "验收标准缺少失败路径与非阻塞约束验证",
      "type": "acceptance",
      "severity": "low",
      "evidence": "步骤6原文：'验收方式：开发环境能看到支付成功事件请求立即发出，普通事件仍进入批量队列。'仅覆盖正常路径，未提及上传失败+重试+回退批量、页面非阻塞、服务端去重等场景。",
      "why_it_matters": "步骤6无法验证硬约束'上报失败不能阻塞支付成功页'是否被满足，也无法验证步骤4的重试与回退逻辑是否工作，验收无法覆盖关键风险路径。",
      "suggested_fix": "补充验收场景：实时上报失败时页面是否立即展示且支付结果不变；重试3次后回退批量队列是否成功；服务端收到重复 event_id 事件是否正确去重。",
      "confidence": 0.75
    },
    {
      "title": "线上旧客户端与两个服务端版本的兼容策略缺失",
      "type": "dependency",
      "severity": "medium",
      "evidence": "背景原文：'线上存在旧客户端和两个服务端版本'；步骤5原文：'JS、原生和服务端在同一个版本窗口一起发布'——但已在线上的旧客户端不会随新版本更新。",
      "why_it_matters": "旧客户端不发送 is_realtime，这本身不影响（走原批量路径）；但两个服务端版本在滚动发布期间可能同时存在，新客户端的实时请求可能打到尚未更新的服务端实例，步骤5的发布协调缺少具体的滚动顺序和兼容保证，使发布步骤无法执行。",
      "suggested_fix": "补充：两个服务端版本的滚动发布顺序（先新后旧还是同时），以及新服务端是否需要对实时上报请求做向后兼容处理（即旧服务端实例收到实时请求时的行为预期）。",
      "confidence": 0.7
    }
  ],
  "missing_questions": [
    "支付成功事件的重复上报在业务上是否可容忍？若不可容忍，event_id 的唯一性生成由谁负责？",
    "实时上传调用的原生接口是现有批量上报的同一 HTTP 端点改为即时调用，还是新增独立端点？",
    "两个服务端版本当前的具体差异是什么？滚动发布时新旧实例并存期间，实时请求打到旧实例的预期行为是什么？"
  ],
  "false_positive_risks": [
    "步骤4未指定重试间隔或退避参数，但硬约束'不能阻塞'已隐含重试必须异步/非阻塞，具体数值属于实现细节而非执行缺口，无需在计划中补全。",
    "is_realtime 放在 payload 顶层而非嵌套子对象，有人可能认为位置模糊，但步骤1和步骤2已明确为'payload 中增加'和'从事件对象顶层读取'，位置语义足以唯一解释。",
    "步骤5'同一个版本窗口一起发布'未拆分为细粒度发布步骤，但当前计划层级是功能设计而非运维发布计划，发布编排属于后续补充而非当前执行缺口。"
  ]
}
