{
  "probe": "rebuttal",
  "issues": [
    {
      "title": "await 阻塞支付成功页，直接违反需求约束",
      "type": "defect",
      "severity": "blocker",
      "evidence": "需求明确写「上报失败不能阻塞支付成功页，也不能改变支付结果」。方案第 3 条要求支付成功页执行 await reportEvent(...)，确认上传成功后再展示结果页。第 4 条规定实时上传失败时重试三次后才降级到批量队列。这意味着在最坏情况下（网络不可用），用户需要在支付完成页等待三次请求超时后才能看到结果，严重阻塞页面。",
      "why_it_matters": "用户在支付完成后可能长时间卡在空白或加载页面，影响用户体验，甚至导致用户重复支付或关闭应用，造成业务损失。这直接违反了需求中的硬性约束。",
      "suggested_fix": "支付成功页不应 await 事件上报。应在支付结果确定后立即展示结果页，同时在后台触发实时上报（fire-and-forget）。上报失败降级到批量队列即可，事件持久化可由本地队列保证，无需通过阻塞 UI 来保证。",
      "confidence": 0.97
    },
    {
      "title": "is_realtime 字段位置定义矛盾",
      "type": "contradiction",
      "severity": "medium",
      "evidence": "方案第 1 条说在 payload 中增加 is_realtime: true（payload 是 reportEvent(name, payload) 的第二个参数，是嵌套对象）。第 2 条说原生桥从「事件对象顶层」读取 is_realtime。如果 payload 被包装进事件对象的某个子字段（如 event.payload），那么顶层和 payload 内部是两个不同的读取路径。",
      "why_it_matters": "JS 团队和原生桥团队可能按照不同的理解实现，导致原生桥永远读不到 is_realtime 标志，实时上报功能完全失效。",
      "suggested_fix": "明确约定 is_realtime 的确切 JSON path，并在 JS SDK 和原生桥的接口文档中统一。建议放在事件对象顶层（与 name、payload 同级），并在 reportEvent 内部自动从 payload 提升到顶层，或增加第三个参数/选项对象。",
      "confidence": 0.88
    },
    {
      "title": "未涉及 event_id 去重机制，存在重复上报风险",
      "type": "missing_constraint",
      "severity": "high",
      "evidence": "需求指出「服务端仅对带有 event_id 的事件去重」。方案全文未提及 event_id 的生成、传递或去重逻辑。第 4 条规定实时上传失败三次后重新放入批量队列，这意味着同一事件可能先通过实时通道发送（服务端可能已接收但客户端未收到确认），后又通过批量通道再次发送。",
      "why_it_matters": "支付成功事件被重复上报会导致服务端重复处理（如重复发放奖励、重复通知商户等），造成资损或数据不一致。",
      "suggested_fix": "方案需明确：(1) 支付成功事件必须携带由客户端生成的幂等 event_id；(2) 实时上报和批量上报使用相同的 event_id；(3) 服务端对 event_id 做去重校验。",
      "confidence": 0.95
    },
    {
      "title": "未处理旧客户端和双版本服务端的兼容性",
      "type": "missing_constraint",
      "severity": "high",
      "evidence": "需求明确提到「线上存在旧客户端和两个服务端版本」。方案第 5 条仅要求 JS、原生和服务端在同一版本窗口发布，但未说明：(1) 旧客户端不含 is_realtime 逻辑时如何保证支付事件仍可正常上报；(2) 两个服务端版本是否都支持实时上报接口和 event_id 去重。",
      "why_it_matters": "旧客户端的用户在支付完成后，事件只会走批量队列（因为没有 is_realtime 标志），实时性无法保证。如果新版客户端对接的是旧版服务端（不支持实时接口或去重），可能导致上报失败或重复处理。",
      "suggested_fix": "方案需补充：(1) 服务端实时上报接口的向后兼容策略（如旧客户端的事件仍走批量通道，不受影响）；(2) 新客户端对两个服务端版本的兼容处理（如接口探测或版本协商）；(3) 灰度发布计划，而非简单的同步发布。",
      "confidence": 0.92
    },
    {
      "title": "重试策略缺少超时和退避机制",
      "type": "risk",
      "severity": "medium",
      "evidence": "方案第 4 条仅写「立即重试三次」，未规定每次请求的超时时间、重试间隔或指数退避策略。在网络抖动场景下，「立即」重试三次可能全部命中同一次网络故障窗口。",
      "why_it_matters": "无超时的请求可能长时间挂起（系统默认超时可能是 60 秒甚至更长），叠加三次重试，用户等待时间不可控。无退避的立即重试在网络故障时几乎无效，浪费资源且延长等待。",
      "suggested_fix": "规定每次请求的超时上限（如 3-5 秒），重试之间加入指数退避（如 1s, 2s, 4s），并设定总等待时间上限（如 10 秒），超过则直接降级到批量队列。",
      "confidence": 0.85
    },
    {
      "title": "应用被杀死时事件可能丢失",
      "type": "risk",
      "severity": "medium",
      "evidence": "方案第 3 条要求 await 上传成功后再展示结果页。如果用户在等待期间强制关闭应用（或系统因内存不足杀死进程），事件尚未成功上传，也未进入批量队列（因为正在实时通道中重试），事件将彻底丢失。",
      "why_it_matters": "支付成功事件丢失意味着服务端无法记录支付结果，可能导致订单状态不一致、对账失败等问题。",
      "suggested_fix": "在调用实时上报之前，先将事件持久化到本地存储（如 SQLite 或本地文件），确保即使应用被杀死，下次启动时批量队列仍可处理该事件。实时上报成功后标记为已发送。",
      "confidence": 0.82
    }
  ],
  "missing_questions": [
    "实时上报接口是复用现有的批量上报接口还是新建独立接口？如果是新接口，旧版服务端是否会有路由问题？",
    "event_id 由谁生成？是 JS 层、原生层还是服务端？如何保证其唯一性？",
    "支付成功页在事件上报期间应展示什么 UI？是否需要 loading 状态？",
    "如果实时上报成功但服务端返回延迟（如排队处理），客户端是否需要同步等待服务端处理完成？",
    "灰度发布时如何验证新旧版本的兼容性？是否有回滚方案？"
  ],
  "false_positive_risks": [
    "方案第 5 条的同步发布策略本身不是缺陷，但在存在旧客户端和双版本服务端的前提下，仅靠同步发布不足以保证兼容性，需要额外的兼容措施。",
    "验收方式（第 6 条）仅在开发环境验证是常见做法，不算缺陷，但缺少线上灰度验证和监控告警的规划是一个风险。"
  ]
}
