{
  "probe": "rebuttal",
  "issues": [
    {
      "title": "Point 3 与约束条件「上报失败不能阻塞支付成功页」直接矛盾",
      "type": "contradiction",
      "severity": "blocker",
      "evidence": "约束条件明确写：'上报失败不能阻塞支付成功页，也不能改变支付结果'。Point 3 写：'支付成功页执行 await reportEvent(...)，确认上传成功后再展示结果页'。Point 3 的语义是：只有上传成功后才展示结果页，这意味着上传失败时用户永远看不到支付成功页。这与约束条件直接冲突。",
      "why_it_matters": "支付是核心交易流程，用户付了钱却看不到成功页属于 P0 事故。即使有重试兜底，若三次重试均失败进入批量队列，await 的语义仍不明确——是 resolve（此时结果页展示但事件实际未实时上报），还是 reject（阻塞结果页），两种行为都与约束条件矛盾。",
      "suggested_fix": "明确 reportEvent 在 is_realtime 模式下，无论上传成功、重试失败进入批量队列、还是最终放弃，await 都必须在有限时间内 resolve（如超时 5s），不阻塞支付成功页展示。结果页展示与上报结果解耦。",
      "confidence": 0.95
    },
    {
      "title": "三次立即重试可能导致支付成功页长时间白屏",
      "type": "defect",
      "severity": "high",
      "evidence": "Point 4 写'立即重试三次'，Point 3 写 await 等待上传成功。若单次请求超时设为 5-10 秒（移动网络常见），三次重试累计可达 15-30 秒。在此期间 await 不返回，用户盯着 loading 或白屏。",
      "why_it_matters": "支付成功是用户体验的峰值时刻，15 秒以上的等待会引发用户焦虑（怀疑是否扣款）、客服投诉甚至重复支付。移动端弱网场景下这种延迟并非极端情况。",
      "suggested_fix": "设定总超时上限（如 5 秒），超时后无论重试结果如何都 resolve，事件走批量队列兜底。或改用 fire-and-forget 模式，结果页不等待上报结果。",
      "confidence": 0.85
    },
    {
      "title": "旧客户端不识别 is_realtime 时静默降级，但调用方无感知",
      "type": "risk",
      "severity": "medium",
      "evidence": "需求背景写明'线上存在旧客户端'。若 JS 传了 is_realtime: true 但用户手机上原生桥版本未更新，该字段被忽略，事件进入批量队列而非实时上报。调用方 await 了 reportEvent 但实际走的是批量路径，await 何时 resolve 取决于批量队列的行为。",
      "why_it_matters": "支付成功事件未实时上报可能导致对账延迟、风控漏报。且调用方以为在等待实时上报结果，实际行为完全不同，形成隐性 bug。",
      "suggested_fix": "原生桥应返回是否支持 is_realtime 的能力标志，或 JS 侧做能力检测。若不支持，调用方应能感知并做降级处理（如改用其他上报通道或记录日志告警）。",
      "confidence": 0.8
    },
    {
      "title": "实时上传成功后响应丢失时，重试 + 批量队列双重发送，缺乏幂等保障",
      "type": "defect",
      "severity": "medium",
      "evidence": "Point 4 规定失败重试三次后进批量队列。考虑场景：实时上传成功但服务端响应在网络层丢失，客户端视为失败→重试三次（都成功，重复上报）→批量队列再发一次。服务端仅按 event_id 去重，但方案未明确 event_id 的生成时机和跨路径一致性。",
      "why_it_matters": "支付成功事件重复上报可能导致对账偏差、风控误判、业务统计失真。去重依赖 event_id，但若每次重试生成新的 event_id 或批量路径使用不同 event_id，去重将失效。",
      "suggested_fix": "在客户端生成 event_id（幂等键），一次支付成功事件从首次实时发送到最终批量队列使用同一个 event_id，确保服务端可正确去重。明确 event_id 的生成规则。",
      "confidence": 0.75
    },
    {
      "title": "验收标准仅覆盖开发环境，未覆盖重试、降级、跨版本兼容等关键路径",
      "type": "missing_constraint",
      "severity": "medium",
      "evidence": "Point 6 验收方式仅检查'开发环境能看到支付成功事件请求立即发出，普通事件仍进入批量队列'。未涉及：三次重试行为、重试失败入批量队列、旧客户端兼容、弱网/超时场景、服务端去重验证。",
      "why_it_matters": "仅验证 happy path 无法保证方案在真实生产环境中的正确性，尤其是移动端弱网、版本碎片化等场景下的表现。",
      "suggested_fix": "补充验收项：模拟网络超时验证重试逻辑、模拟全部失败验证批量队列兜底、旧版本客户端兼容性测试、同一 event_id 去重验证。",
      "confidence": 0.9
    },
    {
      "title": "三端同窗口发布策略在存在旧客户端和两个服务端版本的前提下风险高",
      "type": "risk",
      "severity": "medium",
      "evidence": "Point 5 写'JS、原生和服务端在同一个版本窗口一起发布'。但背景明确'线上存在旧客户端和两个服务端版本'。客户端发版有审核周期和用户更新延迟，服务端灰度发布可能分批次，'同一窗口'在实际操作中难以精确对齐。",
      "why_it_matters": "若服务端先上线但客户端未更新，无影响（客户端不发实时请求）。若客户端先上线但服务端未就绪，实时请求打到旧服务端，可能返回错误或行为不一致。跨版本兼容矩阵未被考虑。",
      "suggested_fix": "明确各端的兼容策略和发布顺序：服务端应先上线（对 is_realtime 字段做向前兼容，未识别时忽略），客户端后发版。服务端对未知字段应有容错处理。",
      "confidence": 0.7
    },
    {
      "title": "实时路径绕过批量队列的本地持久化，App 杀死后事件丢失风险高于批量模式",
      "type": "risk",
      "severity": "low",
      "evidence": "批量队列通常有本地持久化（SQLite/文件），App 杀死后下次启动可恢复。实时路径直接调接口，若发送过程中 App 被杀死，事件未写入任何持久化存储即丢失。Point 4 的重试仅在内存中进行。",
      "why_it_matters": "虽然概率较低，但支付成功页是用户可能立即关闭 App 的场景（支付完成即离开）。若恰好此时网络抖动触发重试中 App 被杀死，事件永久丢失。",
      "suggested_fix": "实时发送前先将事件写入本地持久化存储（或直接写入批量队列并标记为'优先发送'），发送成功后标记完成或删除。这样即使 App 被杀，重启后可恢复。",
      "confidence": 0.6
    }
  ],
  "missing_questions": [
    "reportEvent 在 is_realtime 模式下的 await 超时上限是多少？超时后是 resolve 还是 reject？",
    "event_id 的生成规则是什么？实时路径和批量路径是否使用同一个 event_id？",
    "三次重试的间隔是多少？是否采用退避策略？",
    "旧版本原生桥不识别 is_realtime 时，reportEvent 的 await 行为是什么（立即 resolve 还是等待批量队列？）",
    "服务端两个版本对 is_realtime 字段的处理行为是否一致？是否需要服务端侧改动？",
    "实时上传的接口与批量上传接口是同一个还是独立的？若独立，是否需要新增接口？",
    "支付成功页展示结果页之前，是否还有其他依赖（如订单状态确认）也会被 await 阻塞？"
  ],
  "false_positive_risks": [
    "可能误判：Point 3 的 await 也许意图是等待上传尝试结束（包括失败后入批量队列），而非严格等待上传成功。但原文措辞为'确认上传成功后再展示结果页'，语义明确指向成功。若实际实现为'确认上传流程结束（成功或兜底）后展示'，则矛盾不成立。即便如此，方案文本的歧义本身就是一个需澄清的问题。",
    "可能误判：三端同窗口发布在实际中或许已经考虑了灰度策略，只是方案未展开。方案层面没有提及兼容矩阵和发布顺序，作为评审应当指出这一遗漏，但不排除实施团队已有计划只是未写入方案。"
  ]
}
