{
  "probe": "architecture",
  "issues": [
    {
      "title": "支付成功页同步耦合到遥测上传路径，直接违反硬约束",
      "type": "coupling",
      "severity": "blocker",
      "evidence": "Point 3: 「支付成功页执行 await reportEvent(...)，确认上传成功后再展示结果页，确保事件不会丢失」。硬约束明确要求：「上报失败不能阻塞支付成功页，也不能改变支付结果」。",
      "why_it_matters": "该设计将关键用户可见的支付成功页渲染与遥测上报路径建立同步依赖。即使有三次重试后回退到批量队列的兜底机制，支付成功页仍会被重试过程阻塞（每次重试都涉及网络 I/O）。一旦遥测系统出现延迟或降级，支付成功页的展示将同步受影响。这直接违反了「上报失败不能阻塞支付成功页」的硬约束。同时，「确保事件不会丢失」这一目标被错误地绑定到页面渲染时机上，将事件可靠性问题转化为用户体验问题。",
      "suggested_fix": "将事件上报与支付成功页渲染解耦。实时上报应以 fire-and-forget 方式发起，不阻塞页面展示；事件丢失风险应通过独立的可靠性机制（如本地持久化队列、服务端幂等）而非页面等待来解决。",
      "confidence": 0.95
    },
    {
      "title": "传输路由指令泄漏到业务 payload，跨层边界模糊",
      "type": "boundary",
      "severity": "medium",
      "evidence": "Point 1: 调用方在 payload 中增加 {\"is_realtime\": true}。Point 2: 原生桥从事件对象顶层读取 is_realtime 并据此做路由决策（立即上传 vs 批量队列）。",
      "why_it_matters": "is_realtime 是传输层路由指令，不应嵌入业务数据 payload。这导致：(1) 原生桥层必须解析业务 payload 才能做出路由决策，桥接层与业务数据结构产生了隐藏耦合；(2) JS 调用方通过 payload 约定间接控制原生桥行为，但该约定是隐式的、无 schema 约束的，双方团队（JS 与原生）各自维护时容易产生契约理解偏差；(3) 若未来需要新增其他传输策略（如优先级队列、延迟上报），业务 payload 将持续膨胀传输指令，payload 的职责边界进一步模糊。",
      "suggested_fix": "将路由信号从业务 payload 中提升到传输层。例如作为 reportEvent 的独立参数、使用独立的上报函数变体，或通过消息元数据/header 传递，使原生桥无需解析业务数据即可做出路由决策。",
      "confidence": 0.85
    },
    {
      "title": "跨团队强制同步发布，丧失独立演进能力",
      "type": "coupling",
      "severity": "medium",
      "evidence": "Point 5: 「JS、原生和服务端在同一个版本窗口一起发布」。输入明确说明「JS、原生桥和服务端由不同团队维护」。",
      "why_it_matters": "三个独立团队维护的组件被强制捆绑在同一发布窗口，根源在于 is_realtime 隐式契约要求所有层同时理解该约定。这阻止了各层的独立演进：任何一个团队需要发布其他变更时，都必须等待所有团队对齐窗口；任何一层的发布延迟会阻塞其他层。同时增加了部分部署失败的风险——若只有部分层完成部署，旧层不理解新约定会导致静默降级（支付事件落入批量队列而无感知）。",
      "suggested_fix": "设计层间契约使其向后兼容：旧版原生桥对未知字段默认走批量队列（graceful degradation），新版原生桥仅在识别到路由信号时才切换行为。各层可按自身节奏独立发布，降低协调成本。",
      "confidence": 0.85
    },
    {
      "title": "实时事件缺乏服务端去重所需的 event_id，存在重复上报风险",
      "type": "abstraction",
      "severity": "low",
      "evidence": "需求明确「服务端仅对带有 event_id 的事件去重」。方案未提及实时上传事件是否携带 event_id。Point 4 中实时上传失败重试三次后放回批量队列——若实时上传实际已到达服务端但客户端未收到确认（网络分区），重试或批量队列再次发送将产生重复事件。",
      "why_it_matters": "实时路径的「立即上传 + 失败回退批量队列」机制与重试逻辑叠加，在非事务性上传中天然存在至少一次送达语义。若事件不带 event_id，服务端无法去重，支付成功事件可能被重复计数。这属于架构层面的幂等性缺失，而非实现细节。",
      "suggested_fix": "实时上传路径中为每个事件生成唯一 event_id，使服务端能够对同一事件的多副本进行去重，确保至少一次送达语义下的数据准确性。",
      "confidence": 0.75
    }
  ],
  "missing_questions": [
    "线上旧客户端不发送 is_realtime 时，支付事件落入批量队列——是否可接受？延迟上报的业务影响是什么？",
    "支付成功页对实时上传延迟的容忍上限是多少？三次重试的最坏等待时间是否在可接受范围内？",
    "event_id 的生成与分配机制由哪一层负责？JS 层、原生桥层还是服务端？当前支付事件是否已有 event_id？",
    "两个服务端版本对 is_realtime 字段的处理逻辑是否一致？是否存在旧版服务端忽略该字段导致行为差异？"
  ],
  "false_positive_risks": [
    "使用单一 reportEvent 函数通过 payload 控制行为——可能被视为「上帝函数」或缺乏显式 API 设计，但方案明确要求保持函数签名不变，且单一入口在 v1 阶段可能是合理的简化，不构成结构性缺陷",
    "未建设新的消息平台或数据库——这是输入中的硬约束，不可作为 issue",
    "验收方式仅覆盖开发环境——这是测试策略偏好，不构成架构问题",
    "is_realtime 使用布尔值而非枚举——这是实现细节偏好，当前仅有两种模式，布尔值足够且未来可扩展"
  ]
}
