{
  "probe": "execution",
  "issues": [
    {
      "title": "Step 3 直接违反需求约束：上报失败不能阻塞支付成功页",
      "type": "step",
      "severity": "blocker",
      "evidence": "需求背景：「上报失败不能阻塞支付成功页，也不能改变支付结果。」；方案步骤3：「支付成功页执行 await reportEvent(...)，确认上传成功后再展示结果页，确保事件不会丢失。」",
      "why_it_matters": "await 会阻塞页面渲染直到上传成功或失败，与需求明确禁止阻塞支付成功页的约束直接冲突；若网络慢或服务端异常，用户将长时间无法看到支付结果。",
      "suggested_fix": "改为非阻塞上报：支付成功页先展示结果，同时触发实时上报；上报失败后按步骤4回退批量队列，不阻塞页面。",
      "confidence": 0.95
    },
    {
      "title": "await 与重试逻辑交互未定义：await 何时 resolve",
      "type": "ambiguity",
      "severity": "high",
      "evidence": "步骤3：「执行 await reportEvent(...)，确认上传成功后再展示结果页」；步骤4：「实时上传失败时立即重试三次；仍失败则重新放入批量队列。」",
      "why_it_matters": "await 等待的是单次上传结果还是包含三次重试后的最终结果？若包含三次重试，用户等待时间 = 3 × 单次超时，可能数秒到十几秒；若仅等单次结果，重试期间页面已展示但事件尚未最终确认送达。",
      "suggested_fix": "明确 await 的 resolve 条件：单次成功即 resolve；失败后重试在后台进行，不阻塞 await——或者如上条建议彻底改为非阻塞。",
      "confidence": 0.9
    },
    {
      "title": "未指定需修改的具体文件、模块和平台",
      "type": "file",
      "severity": "high",
      "evidence": "步骤1：「支付成功调用方在 payload 中增加 { \"is_realtime\": true }」；步骤2：「原生桥从事件对象顶层读取 is_realtime」。均无文件路径、模块名或平台(iOS/Android)指定。",
      "why_it_matters": "工程 Agent 无法定位要改的代码位置；不同团队维护不同模块，缺少精确坐标会导致遗漏或改错位置。",
      "suggested_fix": "列出 JS SDK 中支付成功调用方所在文件路径，iOS/Android 原生桥模块名及类/方法，供开发者直接定位。",
      "confidence": 0.85
    },
    {
      "title": "未说明服务端需要什么变更，却要求服务端同版本发布",
      "type": "step",
      "severity": "high",
      "evidence": "步骤5：「JS、原生和服务端在同一个版本窗口一起发布」；整个方案无任何服务端变更描述。",
      "why_it_matters": "服务端团队不清楚自己要做什么，无法配合同版本发布；如果服务端无需变更，就不应纳入同版本窗口，否则徒增协调成本。",
      "suggested_fix": "明确服务端是否需要变更（如新增实时上报接收端点、调整去重逻辑等）；如不需要，从步骤5移除服务端。",
      "confidence": 0.85
    },
    {
      "title": "旧客户端与双版本服务端的向后兼容未分析",
      "type": "dependency",
      "severity": "high",
      "evidence": "需求背景：「线上存在旧客户端和两个服务端版本。」；步骤5：「JS、原生和服务端在同一个版本窗口一起发布。」",
      "why_it_matters": "大窗口同步发布后，线上仍有旧客户端；新JS向旧原生桥发 is_realtime=true 时旧桥是否会忽略该字段？旧JS向新桥发不含 is_realtime 的 payload 是否正常走批量？双服务端版本对 event_id 去重行为是否一致？缺少兼容矩阵会导致线上异常。",
      "suggested_fix": "补充兼容矩阵：新JS→旧桥、旧JS→新桥、旧客户端→新服务端的预期行为，确认是否自然兼容或需额外处理。",
      "confidence": 0.8
    },
    {
      "title": "重试三次缺少延迟、超时和总等待上限",
      "type": "input",
      "severity": "medium",
      "evidence": "步骤4：「实时上传失败时立即重试三次」。",
      "why_it_matters": "「立即」意味着无间隔重试，在网络瞬时故障场景可能浪费连接资源；未指定单次请求超时和总等待上限，若每次超时10秒则3次重试耗时30秒，与支付页体验要求冲突。",
      "suggested_fix": "指定：单次请求超时（如2秒）、重试间隔（如0毫秒或500毫秒）、最大总等待时间（如6秒）。",
      "confidence": 0.8
    },
    {
      "title": "重试与回退批量队列时 event_id 的一致性未说明",
      "type": "dependency",
      "severity": "medium",
      "evidence": "需求背景：「服务端仅对带有 event_id 的事件去重。」；步骤4：「仍失败则重新放入批量队列。」",
      "why_it_matters": "重试3次若使用相同 event_id，服务端可去重；但若回退批量队列后延迟上报时 event_id 变化，服务端将视为不同事件导致重复计数；若 event_id 不变，则去重正确。",
      "suggested_fix": "明确回退批量队列时保留原始 event_id，确保服务端去重生效。",
      "confidence": 0.75
    },
    {
      "title": "验收标准仅覆盖开发环境手动观察，缺少自动化测试和生产验证",
      "type": "acceptance",
      "severity": "medium",
      "evidence": "步骤6：「验收方式：开发环境能看到支付成功事件请求立即发出，普通事件仍进入批量队列。」",
      "why_it_matters": "手动观察无法覆盖：实时上报失败后的重试行为、回退批量队列的正确性、旧客户端兼容性、生产环境真实网络条件下的延迟表现。",
      "suggested_fix": "补充：单元测试覆盖桥层 is_realtime 分支逻辑；集成测试模拟网络失败验证重试和回退；生产灰度期间监控实时上报成功率和延迟。",
      "confidence": 0.85
    }
  ],
  "missing_questions": [
    "支付成功页允许的最大可感知延迟是多少毫秒？这决定 await 是否可行及重试超时上限。",
    "JS SDK 中支付成功事件上报的调用方在哪些文件？iOS 和 Android 原生桥对应的类和方法名是什么？",
    "服务端是否需要变更？如果需要，具体改什么（新增端点、调整去重逻辑、其他）？",
    "旧原生桥收到含 is_realtime 字段的 payload 时，是忽略未知字段还是可能报错？需要确认实际行为。",
    "回退批量队列的事件是否保留原始 event_id？服务端两个版本的去重逻辑是否一致？",
    "单次实时上报请求的超时时间建议设为多少？重试间隔建议设为多少？"
  ],
  "false_positive_risks": [
    "旧原生桥可能自然忽略 payload 中未知顶层字段（JSON 反序列化常见行为），向后兼容问题可能无需额外处理，实际风险低于评估。",
    "服务端可能确实无需变更——实时上报仍走现有上传接口，仅由原生桥决定调用时机；若如此，步骤5纳入服务端是多余的而非缺失服务端变更描述。"
  ]
}
