{
  "probe": "architecture",
  "issues": [
    {
      "title": "支付成功页 await reportEvent 成功违反不可阻塞硬约束",
      "type": "boundary",
      "severity": "blocker",
      "evidence": "需求硬约束要求“上报失败不能阻塞支付成功页，也不能改变支付结果”；方案第 3 步却规定“支付成功页执行 await reportEvent(...)，确认上传成功后再展示结果页”。",
      "why_it_matters": "await 并把 UI 渲染与上报成功绑定，使支付结果页的显示直接依赖网络/上报结果。一旦实时上传或后续回退批量队列均失败，页面要么被阻塞、要么“不阻塞”的硬约束被违反。这种控制流把展示层与上报可靠性硬耦合在一起。",
      "suggested_fix": "将支付结果页渲染与事件上报解耦：上报走异步、不阻塞 UI 的最佳努力路径；结果页按支付业务结果直接展示，不由 reportEvent 的成功与否决定是否渲染。",
      "confidence": 0.95
    },
    {
      "title": "传输策略 is_realtime 由业务调用方写入 payload，造成跨层泄漏",
      "type": "boundary",
      "severity": "high",
      "evidence": "方案第 1 步要求支付调用方在 payload 中增加 {\"is_realtime\": true}；第 2 步又称原生桥“从事件对象顶层读取 is_realtime”来决定路由。",
      "why_it_matters": "is_realtime 是投递/路由策略，却被放在业务调用方构造的 payload 里，导致 JS 业务层掌握原生桥的投递决策。任何策略变更都需修改所有调用方；旧客户端无法在不升级的情况下改变行为；业务数据与传输元数据混淆，且“payload”与“事件对象顶层”的表述不一致，进一步说明契约未澄清。",
      "suggested_fix": "将事件内容契约与投递策略契约分离：投递层根据事件元数据、类型或注册表自主决定实时/批量路由，而非依赖调用方在 payload 中嵌入标志。",
      "confidence": 0.85
    },
    {
      "title": "JS、原生、服务端被强制在同一版本窗口发布，形成发布耦合",
      "type": "coupling",
      "severity": "high",
      "evidence": "方案第 5 步明确“JS、原生和服务端在同一个版本窗口一起发布”。",
      "why_it_matters": "三个组件由不同团队维护，且线上已存在旧客户端和两个服务端版本。强制同步发布制造了大爆炸式依赖，抑制各团队独立演进与回滚能力，违背“线上存在旧版本”所隐含的渐进升级/兼容演进要求。",
      "suggested_fix": "定义前后向兼容的契约与降级行为，使实时路径在新旧客户端、新旧服务端之间可独立灰度与回滚，不要求三方同步发布。",
      "confidence": 0.9
    },
    {
      "title": "实时失败回退批量队列与调用方 await 成功之间存在语义歧义",
      "type": "ownership",
      "severity": "medium",
      "evidence": "方案第 4 步规定“实时上传失败时立即重试三次；仍失败则重新放入批量队列”；第 3 步要求调用方 await 并“确认上传成功”。",
      "why_it_matters": "原生桥拥有“失败→重试→回退批量”的决策权，但调用方却等待并判断“上传成功”。当事件被回退到批量队列时，既非实时上传成功，也非彻底丢失，promise 的 resolve/reject 语义与最终交付保证由谁定义变得模糊，形成对“成功”定义的双重权威。",
      "suggested_fix": "明确 reportEvent 的契约：实时路径为最佳努力，批量路径为持久化兜底；调用方不应以“实时上传成功”作为阻塞条件，而是由内部机制保证最终上报。",
      "confidence": 0.8
    },
    {
      "title": "重试+批量回退路径未与 server 去重契约对齐，存在重复上报风险",
      "type": "coupling",
      "severity": "medium",
      "evidence": "需求说明“服务端仅对带有 event_id 的事件去重”；方案未提及为支付成功实时事件生成 event_id，且第 4 步包含重试三次并回退批量队列。",
      "why_it_matters": "同一事件可能经历实时重试、批量队列多次投递，若缺少稳定 event_id，服务端无法去重，可能导致支付成功事件被重复计数，影响数据可信度。",
      "suggested_fix": "确保所有可能跨实时与批量两条路径投递的事件都携带稳定、唯一的 event_id，且该 id 在重试和回退过程中保持不变。",
      "confidence": 0.7
    }
  ],
  "missing_questions": [
    "await reportEvent 在实时重试全部失败并被回退批量队列时，promise 是 resolve 还是 reject？",
    "is_realtime 是仅由原生桥消费的本地控制字段，还是会随 payload 一起上报给服务端？",
    "支付成功事件是否已有稳定的 event_id 生成机制？",
    "旧版本原生桥遇到不认识的 is_realtime 字段时的默认行为是什么？",
    "服务端新版本是否需要识别实时事件，还是仅按原有接口接收即可？"
  ],
  "false_positive_risks": [
    "“第一版不建设新的消息平台或数据库”是输入硬约束，不应视为结构缺陷。",
    "“重试三次”只是实现参数，其结构后果体现在 fallback 与 UI 阻塞上，不应单独作为架构问题。",
    "“线上存在旧客户端和两个服务端版本”本身不是缺陷，但与“同步发布”结合才构成耦合风险；若方案改为兼容演进，则旧版本存在不构成问题。",
    "payload 中带 is_realtime 可能只是字段命名问题，若整个 payload 被明确定义为可扩展元数据而非纯业务数据，则边界泄漏的判定证据不足。"
  ]
}
