{
  "probe": "rebuttal",
  "issues": [
    {
      "title": "await reportEvent 阻塞支付成功页，违反硬约束",
      "type": "defect",
      "severity": "blocker",
      "evidence": "方案第3条写明\"支付成功页执行 await reportEvent(...)，确认上传成功后再展示结果页\"；需求硬约束写明\"上报失败不能阻塞支付成功页，也不能改变支付结果\"。await 直到上传成功才渲染结果页，意味着上传慢或失败时用户被阻塞，直接违反不可折中的硬约束。",
      "why_it_matters": "硬约束不允许任何阻塞，方案却用 await 显式阻塞页面渲染。专家认可不能消除该问题，因为需求明确写了\"不能阻塞\"，这不是可协商的风险偏好。",
      "suggested_fix": "移除 await 对上传结果的依赖；支付成功页不等待上报完成即可渲染，上报在后台异步执行。仅保留 is_realtime 标记驱动桥层立即发送的逻辑。",
      "confidence": 0.95
    },
    {
      "title": "is_realtime 字段位置：payload 内 vs 事件对象顶层，存在结构矛盾",
      "type": "defect",
      "severity": "high",
      "evidence": "方案第1条写\"在 payload 中增加 { \"is_realtime\": true }\"；第2条写\"原生桥从事件对象顶层读取 is_realtime\"。若 reportEvent(name, payload) 构造的事件对象为 { name, payload } 结构（payload 为嵌套子对象），则 is_realtime 在 payload 内而非顶层，原生桥按顶层读取将找不到该字段，实时路径不会被触发。",
      "why_it_matters": "这是一个确定性的集成失败：JS 层写入位置与原生桥读取位置不一致时，功能静默失效。专家认可可能假定 payload 被展开到顶层，但方案文本未定义事件对象结构，不能默认展开行为存在。",
      "suggested_fix": "方案需明确事件对象的最终结构，确保 is_realtime 在原生桥实际读取的层级；或在方案中将 is_realtime 的写入位置与读取位置统一为同一层级。",
      "confidence": 0.75
    },
    {
      "title": "重试+批量回退产生至少一次投递，方案未确保 event_id 去重保护",
      "type": "risk",
      "severity": "medium",
      "evidence": "方案第4条\"实时上传失败时立即重试三次；仍失败则重新放入批量队列\"。若某次实时请求已到达服务端但响应丢失，后续重试或批量回退将再次投递同一事件，产生重复。需求写\"服务端仅对带有 event_id 的事件去重\"，但方案未明确保证实时路径的 payload 中一定包含 event_id。",
      "why_it_matters": "重试+回退的组合比纯批量路径的重复概率更高。若 event_id 缺失，服务端无法去重，将产生重复事件数据。专家认可可能假设现有 payload 已包含 event_id，但方案将上报模式从批量改为实时+重试+回退，投递语义发生质变，应显式声明 event_id 的存在要求。",
      "suggested_fix": "方案显式要求实时路径的 payload 必须包含 event_id，并在验收条件中加入对重复投递的去重验证。",
      "confidence": 0.65
    }
  ],
  "missing_questions": [
    "旧客户端（未更新原生桥）如何处理新 JS SDK 发送的 is_realtime 字段？旧桥忽略该字段后事件回落批量，这是否是可接受的降级？",
    "两个服务端版本是否都具备处理实时上报事件的能力？若仅新版支持，旧版服务端收到实时事件后的行为是什么？",
    "事件对象的最终传输结构是什么？payload 是作为顶层字段展开还是作为嵌套子对象传递？"
  ],
  "false_positive_risks": [
    "可能将 await 争议降级为\"设计偏好\"而非硬约束违反，理由是 await 仅是开发者的编码习惯选择。但需求明确写\"上报失败不能阻塞支付成功页\"，这是硬约束而非偏好；await 直到成功才渲染是确定性阻塞行为，不能用偏好解释消解。",
    "可能将字段位置问题视为\"实现细节，团队内部对齐即可\"，不值得列为 high。但方案文本中两处描述确指不同层级（payload 内 vs 顶层），这是方案自身的内部矛盾，不是未写明的实现细节。若不修正文本，任何读者按方案字面实现都会产生不一致。"
  ]
}
