{
  "probe": "rebuttal",
  "issues": [
    {
      "title": "await 等待上传完成后再展示结果页，直接违背「上报失败不能阻塞支付成功页」硬约束",
      "type": "defect",
      "severity": "high",
      "evidence": "需求约束明确写死「上报失败不能阻塞支付成功页，也不能改变支付结果」。方案第3点要求「支付成功页执行 await reportEvent(...)，确认上传成功后再展示结果页」。方案第4点进一步规定「实时上传失败时立即重试三次」，三次重试期间页面必然等待，即使用户最终看到页面也经历了不可控的阻塞延迟。",
      "why_it_matters": "硬约束说'不得阻塞'，这不是'允许有限等待'。三次重试的累积延迟（尤其网络差时）直接让支付成功页无法展示。即使 fallback 到批量队列后 await 最终 resolve，用户仍被阻塞了重试时长。这改变了支付成功页的展示时机，属于对硬约束的直接违反。",
      "suggested_fix": "支付成功页必须在上报结果返回前就已展示，即上报与页面展示解耦：reportEvent 改为 fire-and-forget（不 await），或 await 之前先渲染结果页。无论哪种，都不能让结果页的展示依赖于上报的成功或重试完成。",
      "confidence": 0.92
    },
    {
      "title": "未覆盖存量旧客户端：旧原生桥不认识 is_realtime，支付事件将被降级为批量模式",
      "type": "missing_constraint",
      "severity": "high",
      "evidence": "需求明确「线上存在旧客户端」。方案第2点要求原生桥「从事件对象顶层读取 is_realtime。为 true 时立即调用上传接口」。方案第5点「JS、原生和服务端在同一个版本窗口一起发布」只解决新版本一致性问题，对已安装的旧客户端毫无作用——旧原生桥代码中不存在对 is_realtime 的读取逻辑，所有事件一律走批量队列。",
      "why_it_matters": "支付成功需要尽快上报是核心需求。旧客户端上的支付成功事件因原生桥不识别 is_realtime 而永久走批量队列，需求目标在旧客户端上完全落空。这不是渐进覆盖问题，而是方案未声明对旧客户端的预期行为。",
      "suggested_fix": "明确旧客户端的支付成功事件是否可接受走批量队列。若不可接受，需给出旧客户端兜底方案（如 JS 层在检测到旧原生桥时自行发起实时上报，或明确旧客户端版本覆盖计划与容忍期）。",
      "confidence": 0.88
    },
    {
      "title": "重试三次后放入批量队列若也失败，事件丢失且无兜底定义",
      "type": "missing_constraint",
      "severity": "medium",
      "evidence": "方案第4点：「实时上传失败时立即重试三次；仍失败则重新放入批量队列」。到此为止，后续行为未定义。批量队列本身也是本地存储，写入可能因磁盘满、队列满等原因失败。",
      "why_it_matters": "三次重试已耗尽时间窗口，若批量队列写入再失败，该支付成功事件永久丢失，且无任何告警或降级手段。这与「确保事件不会丢失」（方案第3点末尾）的隐含承诺矛盾。",
      "suggested_fix": "定义批量队列写入也失败时的最终兜底：至少应记录本地日志或触发内部告警，或明确接受此极端情况下事件可丢失并说明理由。",
      "confidence": 0.75
    },
    {
      "title": "is_realtime 放在 payload 内部，与原生桥「从顶层读取」的表述存在歧义",
      "type": "contradiction",
      "severity": "low",
      "evidence": "方案第1点将 is_realtime 放在 payload JSON 内部：{ \"is_realtime\": true }。方案第2点说原生桥「从事件对象顶层读取 is_realtime」。reportEvent(name, payload) 的签名下，'事件对象顶层'可能指 payload 的顶层字段，也可能指包裹 payload 的外层事件对象的顶层字段。两处表述不一致。",
      "why_it_matters": "JS、原生桥由不同团队维护。若双方对'顶层'理解不一致，会导致原生桥永远读不到 is_realtime（比如原生在 event 外层找，而 is_realtime 在 event.payload 内层），支付事件静默降级为批量模式。虽然是实现细节，但跨团队接口歧义容易引入集成 bug。",
      "suggested_fix": "统一明确 is_realtime 在 reportEvent 参数中的确切位置：是在 payload 对象内部作为一个字段，还是在与 name、payload 平级的位置由 JS SDK 注入。建议给出一个完整的调用示例消除歧义。",
      "confidence": 0.65
    },
    {
      "title": "未考虑线上两个服务端版本的兼容性",
      "type": "assumption",
      "severity": "medium",
      "evidence": "需求明确「线上存在…两个服务端版本」。方案第5点仅覆盖同步发布新版本，未提及旧服务端版本如何处理实时上报的请求。服务端仅对带 event_id 的去重——实时上报是否必然携带 event_id、旧服务端版本是否能正确处理实时上报的接口路径或参数格式，均未说明。",
      "why_it_matters": "如果实时上报使用了新的接口路径或旧服务端不识别的参数，旧服务端可能返回错误，触发客户端重试三次后 fallback 到批量队列，等于所有打到旧服务端的实时上报全部退化。这与尽快上报的目标背道而驰。",
      "suggested_fix": "明确实时上报是否沿用现有上传接口。若是，需确认两个旧服务端版本对该接口的实时调用无副作用；若否，需给出旧服务端的处理策略或声明旧版本淘汰时间窗口。",
      "confidence": 0.7
    }
  ],
  "missing_questions": [
    "实时上报请求是否必然携带 event_id？若不带，服务端去重对实时上报是否失效？",
    "旧服务端是否支持实时上报的调用方式（接口路径、参数格式是否与批量上传一致）？",
    "三次重试的时间间隔是多少？用户在网络极差场景下最长会被阻塞多久？",
    "批量队列是否有容量上限？重试失败放入队列是否会触发队列满的情况？"
  ],
  "false_positive_risks": [
    "将 await 的非阻塞异步等待误解为 UI 线程卡死——但方案明确说'确认上传成功后再展示结果页'，从用户视角结果页确实不出现，因此'不阻塞 UI 线程'不能消除'阻塞结果页展示'这一事实。",
    "将旧客户端问题过度升级——也许旧客户端本来就不需要实时上报。但需求未声明旧客户端是否在实时上报的范围内，方案同样未声明此豁免，因此标记为 missing_constraint 而非 defect。",
    "将 is_realtime 位置歧义过度放大——实际开发中跨团队自然会沟通对齐，但方案文本作为被评审对象，其内在不一致是需要修正的点，标记为 low 已反映其更可能是文档歧义而非设计缺陷。"
  ]
}
